{
  "schema_version": "1.0",
  "report_id": "mismatch-42",
  "created_at": "2026-10-10T03:00:00Z",
  "context": {
    "domain_id": "factory-maintenance-a",
    "bundle_digest": "sha256:0c0e274d2c2d34804415f343b9cd444f643288289f6d734be92911b6ef125ca2",
    "semantic_snapshot_digest": "sha256:5971eeedb0430376d5246404a917f16c0ff9f70e5b62dc6566a9dc32e38d5681",
    "deployment_epoch": 6,
    "state_epoch": 3,
    "principal_id": "maintenance-runtime",
    "workflow_id": "maintenance-42",
    "knowledge_read_view": "transaction:819",
    "knowledge_consistency": "transaction_watermark",
    "knowledge_freshness_policy": {
      "sha256": "sha256:325f9b0419ff60227bb7dfc958548a29ea1bfc236915d16315ccf9f5591351f5",
      "locator": "fixture:knowledge-freshness-policy",
      "media_type": "application/octet-stream",
      "display_version": "fixture-1"
    },
    "context_origin": "trusted_runtime",
    "runtime_instance_id": "runtime-a-7",
    "runtime_attestation": {
      "sha256": "sha256:f81169e8c357e9632fc9be5bb0d20f8a655972be845edcc0971335627e3432c5",
      "locator": "fixture:trusted-runtime-binding-record",
      "media_type": "application/octet-stream",
      "display_version": "fixture-1"
    }
  },
  "observation": {
    "sha256": "sha256:b8020e96ab591cee07518024c246aefd0682e8da5c2b43d1340bb4d3756856b0",
    "locator": "fixture:correlated-machine-fault-observation",
    "media_type": "application/octet-stream",
    "display_version": "fixture-1"
  },
  "evidence": [
    {
      "sha256": "sha256:0c5ea609549bf4ed98fa2e337933f4c7d1ed9d8671d181d3cc52c08c09907cff",
      "locator": "fixture:maintenance-report-evidence",
      "media_type": "application/octet-stream",
      "display_version": "fixture-1"
    }
  ],
  "mismatch_categories": [
    "schema_gap",
    "procedure_gap"
  ],
  "diagnosis_status": "provisional",
  "failed_concepts": [
    "CoupledMachine"
  ],
  "insufficient_procedure_refs": [
    {
      "sha256": "sha256:de0052a38071df5bdbb0da682a7bd0b2877774a3d312d2ad16d5532664fe4f84",
      "locator": "fixture:single-machine-reset-procedure",
      "media_type": "application/octet-stream",
      "display_version": "fixture-1"
    }
  ],
  "explanation": "Repeated simultaneous machine faults cannot be explained by the independent-machine model; shared control is a provisional hypothesis requiring investigation.",
  "operational_consequence": "Affected resets for maintenance-42 are held pending investigation of shared control and action scope.",
  "provisional_interpretation": {
    "statement": "M17 and M18 may share a controller, requiring a controlledBy relation and coordinated diagnostic capability.",
    "confidence": 0.7
  },
  "disposition": {
    "affected_workflow_ids": [
      "maintenance-42"
    ],
    "action": "suspend_affected_work",
    "rule": {
      "sha256": "sha256:587e3499ab7b2f94737cfdcad0e5c12e76ba2f91ea96a96da3b62fa40dbd43ed",
      "locator": "fixture:affected-asset-authorization-rule",
      "media_type": "application/octet-stream",
      "display_version": "fixture-1"
    },
    "rationale": "The affected-asset authorization rule blocks resets while impact or authority remains unresolved."
  },
  "correlation_id": "change-42"
}
